{
  "format": "asakiri-course",
  "formatVersion": 1,
  "id": "record_bird",
  "collectionId": "collection_vocabulary",
  "fields": {
    "field_japanese": {
      "kind": "text",
      "value": "鳥"
    },
    "field_english": {
      "kind": "text",
      "value": "bird"
    },
    "field_images": {
      "kind": "list",
      "items": [
        {
          "id": "image_bird_primary",
          "kind": "asset",
          "label": "Bird illustration",
          "assetId": "asset_bird_image"
        }
      ]
    },
    "field_tags": {
      "kind": "list",
      "items": [
        {
          "id": "tag_bird_animal",
          "kind": "text",
          "value": "animals"
        }
      ]
    }
  }
}
